Book Name;ISBN;Price (EUR);Original Price;Original Currency;Available
"Детский журнал ""Фита"" №3";N/A;13,85;340,00;CZK;Yes
"Детский журнал ""Фита"" №2";N/A;13,85;340,00;CZK;Yes
"Детский журнал ""Фита"" №1";N/A;13,85;340,00;CZK;Yes
Виктор Пелевин. A sinistra;N/A;16,30;400,00;CZK;Yes
Диктатор, который умер дважды: Невероятная история Антониу Салазара;978-5-9614-8781-7;13,53;332,00;CZK;Yes
Елена Костюченко «Моя любимая страна»;978-9934-23-942-7;24,45;600,00;CZK;Yes
Дмитрий Глуховский. Мы. Дневник падения;978-80-974683-0-9;27,30;670,00;CZK;Yes
Павел Казарин. Дикий Запад Восточной Европы;978-966-982-689-3;8,15;200,00;CZK;Yes
Натали Безмен. Доктор покупает ботинки;N/A;12,22;300,00;CZK;Yes
Анна Берсенева. Рейнское золотое;N/A;13,04;320,00;CZK;Yes
Тод Штрассер. Волна;978-5-91759-750-8;10,19;250,00;CZK;Yes
Джонатан Литтелл и Антуан Д’Агата. «Неудобное место»;978-9934-9216-3-6;30,56;750,00;CZK;Yes
"Свен Нурдквист ""Переполох в огороде""";978-5-00114-365-9;11,00;270,00;CZK;Yes
"Свен Нурдквист ""Петсон идёт в поход""";978-5-00114-340-6;11,41;280,00;CZK;Yes
"Свен Нурдквист ""Петсон и Финдус изучают животных""";978-5-00114-389-5;9,78;240,00;CZK;Yes
"Свен Нурдквист ""Петсон грустит""";978-5-00114-339-0;11,41;280,00;CZK;Yes
"Свен Нурдквист ""Охота на лис""";978-5-906640-07-9;11,00;270,00;CZK;Yes
Андрей Зубов. История России XIX столетия (том 1);978-80-69096-05-9;30,56;750,00;CZK;Yes
"Владимир Сорокин ""Наследие""";978-5-17-145803-4;24,45;600,00;CZK;Yes
Джон Хейвуд: Люди Севера (плотная обложка);978-5-00139-000-8;18,34;450,00;CZK;Yes
Виктор Шендерович. Девяноска;978-80-974683-2-3;26,49;650,00;CZK;Yes
Эмманюэль Гибер, Марк Бутаван. Ариоль. Лучший в мире поросенок;978-5-907305-53-3;12,22;300,00;CZK;Yes
"Андрей Макаревич ""Звонок телефона в осеннем лесу""";978-965-93083-0-9;18,34;450,00;CZK;Yes
Люси и Стивен Хокинг: Джордж и Большой взрыв;978-5-4370-0201-8;20,37;500,00;CZK;Yes
Эмманюэль Гибер, Марк Бутаван. Ариоль. Телячьи нежности;978-5-906331-63-2;12,22;300,00;CZK;Yes
Эмманюэль Гибер, Марк Бутаван. Ариоль. Шевалье Мустанг;978-5-907305-65-6;12,22;300,00;CZK;Yes
Эмманюэль Гибер, Марк Бутаван. Ариоль. Танцуют все;978-5-907305-62-5;12,22;300,00;CZK;Yes
Эмманюэль Гибер, Марк Бутаван. Ариоль. Муха-горюха;978-5-906331-87-8;12,22;300,00;CZK;Yes
Эмманюэль Гибер, Марк Бутаван. Ариоль. Господин Пес;978-5-907305-70-0;12,22;300,00;CZK;Yes
Даниил Туровский. Разрыв;978-9934-9216-6-7;18,34;450,00;CZK;Yes
Мишель Уэльбек: Уничтожить;978-5-17-148330-2;25,26;620,00;CZK;Yes
Энн Эпплбаум: ГУЛАГ;N/A;30,56;750,00;CZK;Yes
Свен Нурдквист: Рождество в домике Петсона;N/A;11,41;280,00;CZK;Yes
Ирина Фуфаева: Как называются женщины. Феминитивы: история, устройство, конкуренция;N/A;15,28;375,00;CZK;Yes
"Илья Барабанов, Денис Коротков. «Наш бизнес — смерть». Полная история ЧВК ""Вагнер"" и ее основателя Евгения Пригожина";978-9934-9216-2-9;24,45;600,00;CZK;Yes
Григорий Родченков. Допинг. Запрещенные страницы;978-9934-9255-0-4;24,45;600,00;CZK;Yes
"Евгений Торчинов ""Введение в буддизм""";978-5-17-158797-0;22,41;550,00;CZK;Yes
Вторая навигация, философский сборник статей альманаха;978-3-03974-035-2;27,50;675,00;CZK;No
Валерий Бочков. Харон;978-617-8169-86-2;12,22;300,00;CZK;No
Якуб Микановски. Гудбай, Восточная Европа!;978-5-04-195741-4;10,19;250,00;CZK;Yes
Елена Колина: Толстовский дом;978-5-17-088455-1;15,89;390,00;CZK;Yes
Вера Полозкова. Lost and Found;978-80-69096-08-0;20,37;500,00;CZK;Yes
"Мария Грипе ""... И белые тени в лесу""";978-5-00114-003-0;14,26;350,00;CZK;Yes
"Мария Грипе ""Тайник теней""";978-5-00114-051-1;16,30;400,00;CZK;No
"Мария Грипе ""Дети теней""";978-5-00114-024-5;14,26;350,00;CZK;Yes
"Мария Грипе ""Тень на каменной скамейке""";978-5-906640-84-0;9,98;245,00;CZK;Yes
"Мария Грипе ""Сесилия Агнес - Странная история""";978-5-906640-63-5;9,98;245,00;CZK;Yes
"Умберто Эко ""Маятник Фуко""";978-5-17-083189-0;32,60;800,00;CZK;Yes
"Джим Старлин ""Танос. Откровение бесконечности""";978-5-6040123-4-5;24,45;600,00;CZK;Yes
"Роберто Карнеро ""Пазолини. Умереть за идеи""";978-5-17-154913-8;21,60;530,00;CZK;Yes
"Тилли Уолден ""Пируэт""";978-5-906331-86-1;21,60;530,00;CZK;Yes
"Фредерик Питерс ""Голубые таблетки""";978-5-906331-52-6;14,67;360,00;CZK;Yes
"Юрий Гуголев ""От гульбищ до капищ""";978-3-910741-28-7;14,67;360,00;CZK;Yes
"Сэмюэл Мойн ""Последняя утопия. Права человека в истории""";978-5-4448-2128-2;20,37;500,00;CZK;Yes
"Тодж Нейтон ""Преступный разум""";978-5-00223-016-7;7,33;180,00;CZK;Yes
Хрестоматия Тотального диктанта от Быкова до Яхиной;978-5-04-099074-0;6,52;160,00;CZK;Yes
"Тибо Дамур ""Мир по Эйнштейну. От теории относительности до теории струн:""";978-5-91671-485-2;12,22;300,00;CZK;Yes
"Эткинд ""Кривое горе""";978-5-4448-2248-7;15,48;380,00;CZK;Yes
"Кен Дженнингс ""Греческие мифы""";978-5-00074-118-4;8,15;200,00;CZK;Yes
"Иван Беляев ""Вацлав Гавел. Жизнь в истории""";978-5-4448-1206-8;14,67;360,00;CZK;Yes
"Алексей Иванов ""Ненастье"" (дефект обложки)";978-5-00223-095-2;12,22;300,00;CZK;Yes
"Андрей Пионтковский ""Третий путь ... к рабству"". Том 1";978-3-910741-96-6;20,37;500,00;CZK;Yes
"Адам Туз. ""Всемирный потоп. Великая война и переустройство мирового порядка, 1916-1931 годы""";978-5-93255-503-3;36,67;900,00;CZK;No
"Адам Туз. ""Крах. Как десятилетие финансовых кризисов изменило мир""";978-5-93255-563-7;36,67;900,00;CZK;No
"Б. Чухович ""Любовь, дружба, вечность Усто Мумина""";978-80-908899-1-0;32,60;800,00;CZK;Yes
"Алексей Смирнов фон Раух ""Доска Дионисия""";978-5-907696-30-3;20,37;500,00;CZK;Yes
Джованни Чиварди: Анатомия для Художников. Самое полное пособие по рисованию человека;978-5-04-097645-4;22,41;550,00;CZK;Yes
Пришёл, увидел и убил. Как и почему римляне убивали. Эмма Саутон;978-5-04-118148-2;13,85;340,00;CZK;Yes
Даша Димитрова, Ольга Дергачёва. Я кабан, а вы вонючки!;978-5-00167-446-7;14,26;350,00;CZK;Yes
Даша Димитрова. Морж как морж, ничего особенного;978-5-00167-208-1;12,63;310,00;CZK;Yes
"Иоганн-Амвросий Розенштраух ""Исторические происшествия в Москве 1812 года во время присутствия в сем городе неприятеля""";978-5-4448-0270-0;16,30;400,00;CZK;Yes
Георгий Касьянов: Украина и соседи: историческая политика. 1987-2018;N/A;30,97;760,00;CZK;Yes
Вадик Королев. Снеговик;N/A;17,11;420,00;CZK;Yes
Руту Модан. Имущество;978-5-907305-17-5;11,41;280,00;CZK;Yes
Люк Перино. Нулевой пациент;978-5-04-120551-5;0,00;0,00;CZK;Yes
Ксения Кириллова. Ошибка Эфрона;978-3-00-073006-1;10,80;265,00;CZK;Yes
Виктор Вахштайн. Техника;978-5-94380-336-9;8,96;220,00;CZK;Yes
Кобо Абэ. Женщина в песках. Чужое лицо;978-5-367-00311-6;8,15;200,00;CZK;Yes
Брэдли Хоуп, Джастин Шек. Нефть и Кровь;978-5-9614-9182-1;14,67;360,00;CZK;Yes
Стюарт Ричи. Наукообразная чушь;978-5-17-136104-4;19,56;480,00;CZK;Yes
Алексей Зайцев. Физика Тузика;978-5-91759-807-9;12,22;300,00;CZK;Yes
Федор Сваровский. Беспорядок в саванне;978-965-92929-2-9;12,22;300,00;CZK;Yes
Герман Лукомников. Стихи из России (2022-2023);978-965-93083-8-5;11,41;280,00;CZK;Yes
Пряник с трещинкой. The Cracked Gingerbread, И.Асеева (рус., англ.);978-3-03974-018-5;18,34;450,00;CZK;Yes
Шарль Фердинан Рамю. Пришествие поэта;978-965-93125-7-3;16,30;400,00;CZK;Yes
Борис Акунин: Москва-Синцзин;979-8--99028162-2;24,45;600,00;CZK;Yes
Кирилл Кобрин. Пять эссе о войне и болезни;978-965-93125-4-2;10,59;260,00;CZK;Yes
Евгений Фельдман. Мечтатели против космонавтов;978-1-965369-28-9;34,63;850,00;CZK;Yes
Олег Кашин. Ничего хорошего. От начала войны до похорон Навального;978-3-689-59000-0;19,56;480,00;CZK;Yes
Маржан Сатрапи. Вышивки;978-5-907305-00-7;7,33;180,00;CZK;Yes
Стивен Уокер. Первый. Новая история Гагарина и космической гонки;978-5-00139-664-2;14,67;360,00;CZK;Yes
Лев Рубинштейн. Кладбище с вайфаем;978-5-4448-1244-0;18,34;450,00;CZK;Yes
Дидье Блонд. Адресная книга вымышленных литературных персонажей;978-5-7516-1752-3;20,37;500,00;CZK;Yes
Владимир Набоков. Бледный огонь;978-5-17-137834-9;14,26;350,00;CZK;Yes
"Мария Гельфонд: Комментарий к трилогии А. Бруштейн ""Дорога уходит в даль""";978-5-9906261-8-8;11,82;290,00;CZK;No
Юлия Яковлева. Дети ворона;978-5-91759-444-6;15,48;380,00;CZK;Yes
Алки Зеи. Леопард за стеклом;978-5-00167-571-6;14,67;360,00;CZK;Yes
Тамара Эйдельман. Тайны древних цивилизаций;978-5-17-151620-8;14,67;360,00;CZK;Yes
Кормак Маккарти. Дорога;978-5-389-14385-2;8,15;200,00;CZK;Yes
Том Джексон: Главное в истории науки;978-5-00195-705-8;14,26;350,00;CZK;Yes
Ирина Кувшинская: Воссозданный Рим;N/A;44,82;1100,00;CZK;Yes
Лидия Чуковская: Памяти детства. Мой отец - Корней Чуковский;N/A;16,30;400,00;CZK;Yes
Ника Дубровская: НЕ/СПРАВЕДЛИВОСТЬ;N/A;17,11;420,00;CZK;Yes
Антон Носик: Лытдыбр. Дневники, диалоги, проза;N/A;40,75;1000,00;CZK;Yes
Барбара Оакли: Думай как математик. Как решать любые проблемы быстрее и эффективнее;N/A;21,19;520,00;CZK;Yes
Марина Голубева: Главное в истории мифологии;978-5-00214-044-2;14,26;350,00;CZK;Yes
Джоэль Бен-Иззи: Царь-оборванец и секрет счастья;978-5-907056-23-7;11,21;275,00;CZK;Yes
Даниэль Аррас: Взгляд улитки. Описания неочевидного;978-5-91103-516-7;9,17;225,00;CZK;Yes
Ян Немец: Возможности любовного романа;N/A;24,86;610,00;CZK;Yes
Дмитрий Галковский: Необходимо и достаточно;N/A;27,71;680,00;CZK;Yes
Вадим Фролов: Что к чему;978-5-91759-622-8;13,04;320,00;CZK;Yes
Пелам Вудхаус: Дживс, вы - гений! Ваша взяла, Дживс! Фамильная честь Вустеров;N/A;17,52;430,00;CZK;Yes
Юбер Кривин: Маленький трактат о случае и случайностях;978-985-90468-9-6;12,22;300,00;CZK;Yes
Джеймс Хэрриотт: О всех созданиях, мудрых и удивительных;978-5-389-19599-8;17,32;425,00;CZK;Yes
Андраш Форгач: Незакрытых дел - нет;978-5-17-112600-1;25,67;630,00;CZK;Yes
Джеймс Хэрриотт: Вечное чудо жизни;978-5-389-17849-6;17,32;425,00;CZK;Yes
Ирина Хакамада: Дао жизни. Мастер-класс от убежденного индивидуалиста;N/A;17,11;420,00;CZK;Yes
Джеймс Хэрриот: И всех их создал Бог;978-5-389-17848-9;17,32;425,00;CZK;Yes
Ричард Нельсон-Фрай: Бухара в Средние века;978-5-9524-5207-7;12,22;300,00;CZK;Yes
На сердце пали все печали. Судьбы крестьян в XX веке. Воспоминания.;978-5-9909766-1-0;10,19;250,00;CZK;Yes
Мария Степанова. Фокус;978-5-98379-271-5;10,19;250,00;CZK;Yes
Ирина Терпугова. Борджиа. Первая итальянская мафия;978-5-17-162865-9;12,22;300,00;CZK;Yes
Ханна Арендт: Vita Activa, или О деятельной жизни;N/A;34,23;840,00;CZK;Yes
"Марион Файоль ""Голый дом""";978-5-907305-67-0;30,56;750,00;CZK;Yes
"Адам Михник, Алексей Навальный ""Диалоги""";N/A;14,26;350,00;CZK;Yes
Ниал Фергюсон: Восхождение денег. Финансовая история мира;N/A;24,45;600,00;CZK;Yes
Александр Бушковский: Рымба;978-5-17-115094-5;7,17;176,00;CZK;Yes
Мадлен Циге: В лесу никто не молчит. Как животные и растения общаются друг с другом;N/A;17,52;430,00;CZK;No
Леон Юрис. Исход;978-5-7516-1621-2;24,45;600,00;CZK;Yes
Борис Акунин. Адвокат Беса;N/A;15,48;380,00;CZK;Yes
Нил Прайс. История викингов. Дети ясеня и вяза;978-5-389-18416-9;18,34;450,00;CZK;Yes
Андрей Бульбенко, Марта Кайдановская. Сиди и смотри;978-5-00167-455-9;9,37;230,00;CZK;Yes
Кирстен Фукс. Свора девчонок;978-5-91759-941-0;12,22;300,00;CZK;Yes
Дэвид Маклеллан. Карл Маркс. Человек, изменивший мир;978-5-389-22598-5;29,34;720,00;CZK;Yes
Дональд Каган. Пелопонесская война;978-5-00223-107-2;29,34;720,00;CZK;Yes
Дмитрий Травин. Почему Россия отстала?;978-5-0063-0013-2;14,67;360,00;CZK;Yes
Марк Доббс. Карточный домик;978-5-04-094547-4;10,19;250,00;CZK;No
Полина Жеребцова. 45-я параллель;978-3-03974-041-3;22,41;550,00;CZK;Yes
Полина Жеребцова. Тонкая серебристая нить;978-3-907131-85-5;27,50;675,00;CZK;Yes
Полина Жеребцова. Тюкины дети;978-3-03974-044-4;22,41;550,00;CZK;Yes
Джин Дюпро. Город Эмбер. Побег;978-5-389-00320-0;0,00;0,00;CZK;Yes
"Рэй Монк. ""Оппенгеймер. Жизнь в  центре""";978-5-85006-359-7;68,25;1675,00;CZK;Yes
Александр Тимофеевский: Я енот;N/A;15,48;380,00;CZK;Yes
Константин Антипов: Я свинья;N/A;15,48;380,00;CZK;Yes
Колосок. Украинские народные сказки;N/A;12,22;300,00;CZK;Yes
Грибова Любовь: Как вас звать-величать? Белорусские народные сказки;N/A;16,71;410,00;CZK;Yes
Алан Серр: Я имею право быть ребенком;N/A;21,19;520,00;CZK;No
Борис Кузнецов: Я козел;N/A;15,48;380,00;CZK;Yes
Елена Коренева: Я белка;N/A;15,48;380,00;CZK;Yes
Евгений Клюев. Если хочешь быть красивым. Энциклопедия хотений;978-5-91759-975-5;12,63;310,00;CZK;Yes
Джойс Оутс: Сага о Бельфлерах;N/A;41,56;1020,00;CZK;Yes
Оскар Уайльд: Великан-эгоист;978-5-7516-1549-9;16,30;400,00;CZK;Yes
Настя Томская: Черемушки;978-5-93381-407-8;32,60;800,00;CZK;Yes
Майя Кастелиц: Мальчик и дом;N/A;8,96;220,00;CZK;Yes
Джудит Керр: Мяули. Новые истории из жизни удивительной кошки (дефект обложки);N/A;20,37;500,00;CZK;Yes
Джованни Чиварди: Рисование. Полное руководство;978-5-00057-551-2;22,41;550,00;CZK;Yes
Александр Шибаев: Точка, точка, запятая;N/A;11,41;280,00;CZK;Yes
Юлия Мазурова: Зеркало Алхимика;978-5-907423-47-3;18,34;450,00;CZK;Yes
Юлия Мазурова: Дверь в Англию;978-5-907423-20-6;18,34;450,00;CZK;Yes
Ричард Рэнгем: Парадокс добродетели. Странная история взаимоотношений нравственности и насилия в эволюции человека;N/A;31,78;780,00;CZK;Yes
Анне-Катрине Вестли: Уле-Александр переезжает;N/A;16,71;410,00;CZK;Yes
Лейла Слимани: Страна других. Книга вторая. Смотрите, как мы танцуем;N/A;23,02;565,00;CZK;Yes
Евнухи в Византии. Шон Тафернер;978-5-17-147624-3;20,37;500,00;CZK;Yes
Ниал Фергюсон, Марк Алмонд, Джон Адамсон: Виртуальная история. Альтернативы и предположения;978-5-17-109115-6;25,67;630,00;CZK;Yes
Карин Клеман: Патриотизм снизу. «Как такое возможно, чтобы люди жили так бедно в богатой стране?»;N/A;20,37;500,00;CZK;Yes
Окрест, Бузев, Кувалдин: Она развалилась. Повседневная история СССР и России в 1985-1999 гг.;N/A;20,78;510,00;CZK;Yes
Андрей Шарый: Балканы: Окраины империй;N/A;27,30;670,00;CZK;Yes
Йозеф Паздерка: Вторжение: Взгляд из России. Чехословакия, август 1968;N/A;16,30;400,00;CZK;Yes
Олег Хлевнюк: Сталин. Жизнь одного вождя;N/A;22,00;540,00;CZK;Yes
Сергей Плохий: Потерянное царство. Поход за имперским идеалом и сотворение русской нации (с 1470 г. до наших дней);N/A;29,34;720,00;CZK;No
Катерина Гордеева: Правила ведения боя. #победитьрак;N/A;27,71;680,00;CZK;Yes
Комитет охраны мостов. Дмитрий Захаров;978-5-17-152857-7;16,30;400,00;CZK;Yes
Лев Гудков, Карина Пипия, Наталия Зоркая: Постсоветская молодежь. Предварительные итоги;N/A;20,37;500,00;CZK;Yes
Альфред Шклярский: Томек в стране кенгуру;N/A;20,37;500,00;CZK;Yes
Софья Багдасарова: Омерзительное искусство. Юмор и хоррор шедевров живописи;N/A;21,96;539,00;CZK;Yes
Массимилиано Вирджилио: Американец;978-5-17-107010-6;15,89;390,00;CZK;Yes
Пелам Вудхаус: На помощь, Дживс! Держим удар, Дживс!;N/A;13,85;340,00;CZK;Yes
Стивен Фрай: Троя. Величайшее предание в пересказе;N/A;23,63;580,00;CZK;Yes
Колм Тойбин: Волшебник;N/A;24,45;600,00;CZK;Yes
Ральф Дарендорф: Соблазны несвободы. Интеллектуалы во времена испытаний;N/A;17,11;420,00;CZK;Yes
Павел Басинский: Лев Толстой (ЖЗЛ);N/A;24,86;610,00;CZK;Yes
Мэтью Гэбриэль, Дэвид Перри: Светлое Средневековье. Новый взгляд на историю Европы V-XIV веков;N/A;27,71;680,00;CZK;Yes
Филип Боббитт: Щит Ахилла. Война, мир и ход истории. Том первый;N/A;17,11;420,00;CZK;Yes
Аркадий Островский: Говорит и показывает Москва;978-5-17-093381-5;21,80;535,00;CZK;Yes
Галина М. Артемьева: Предания, сказки и мифы Западных славян;N/A;14,67;360,00;CZK;Yes
Альфред Шклярский: Томек на Черном континенте;N/A;21,19;520,00;CZK;Yes
Татьяна Хохрина: Дом общей свободы;N/A;20,78;510,00;CZK;Yes
Натали Барнс: Доктор Кто. Дневник путешественника во времени;N/A;17,52;430,00;CZK;Yes
Елена Смешливая, Лана Богомаз: Чему я могу научиться у Анны Ахматовой;N/A;14,26;350,00;CZK;Yes
Евгений Водолазкин: Брисбен;N/A;19,15;470,00;CZK;Yes
Александр Эткинд: Природа зла. Сырье и государство;N/A;36,26;890,00;CZK;Yes
Застолье Петра Вайля;N/A;21,80;535,00;CZK;Yes
Фрай Макс, Бормор Петр, Горалик Линор. Русские инородные сказки-3. Антология;N/A;11,82;290,00;CZK;Yes
Уильям Шекспир: Комедии;N/A;22,41;550,00;CZK;Yes
Николас Старгардт: Мобилизованная нация. Германия 1939-1945;N/A;33,41;820,00;CZK;Yes
Восьмой поверенный. Ренато Баретич;978-5-91922-091-6;15,48;380,00;CZK;Yes
Мария Швец: Главное в истории русского искусства. Ключевые работы, темы, техники, направления;N/A;14,26;350,00;CZK;Yes
Юрген Вольф: Школа литературного и сценарного мастерства. От замысла до результата;N/A;16,30;400,00;CZK;Yes
Моурик, Баранникова: Перевод русского. Дневник фройляйн Мюллер - фрау Иванов;978-5-04-095814-6;17,93;440,00;CZK;Yes
Гэри Шмидт: Пока нормально;N/A;26,08;640,00;CZK;Yes
Линор Горалик: Холодная вода Венисаны;N/A;11,82;290,00;CZK;Yes
Дворец сновидений. Исмаиль Кадарэ;978-5-6045077-1-1;21,19;520,00;CZK;Yes
Александр Генис: Уроки чтения. Камасутра книжника;N/A;0,00;0,00;CZK;No
Екатерина Болтунова: Последний польский король. Коронация Николая I в Варшаве в 1829 году;N/A;41,97;1030,00;CZK;Yes
Киф Радден: Ничего не говори. Северная Ирландия. Смута, закулисье, «голоса из могил»;N/A;17,11;420,00;CZK;Yes
Лиутпранд Кремонский: Антаподосис. Книга об Оттоне. Отчет о посольстве в Константинополь;978-5-93165-300-6;12,22;300,00;CZK;Yes
Роберто Боланьо: 2666;N/A;34,63;850,00;CZK;Yes
Анне-Катрине Вестли: Уле-Александр и его друзья;N/A;16,71;410,00;CZK;Yes
Анне-Катрине Вестли: Папа, мама, бабушка и восемь детей в Дании;N/A;16,71;410,00;CZK;Yes
Анне-Катрине Вестли: Папа, мама, бабушка и восемь детей в деревне, или Маленький подарок Антона;N/A;16,71;410,00;CZK;Yes
Анне-Катрине Вестли: Опасное путешествие Щепкина;N/A;16,71;410,00;CZK;Yes
Масару Ибука: После трех уже поздно;N/A;15,08;370,00;CZK;Yes
Линор Горалик: Тайные ходы Венисаны;N/A;12,63;310,00;CZK;Yes
Линор Горалик: Двойные мосты Венисаны;N/A;12,63;310,00;CZK;Yes
Патрик Модиано: Ночная трава;978-5-7516-1304-4;10,59;260,00;CZK;Yes
